{
  "member": {
    "name": "Example Fictional Registry",
    "website": "https://registry.example.org"
  },
  "resource_functions": [
    {
      "tag": "indexing",
      "basis": "inferred",
      "uncertainty": "Fictional; no real resource was inspected."
    },
    {
      "tag": "submissions",
      "basis": "supplied"
    }
  ],
  "audit_date": "2026-01-01",
  "access_limitations": [
    "FICTIONAL FIXTURE: no real member or website was audited."
  ],
  "baseline": {
    "id": "S4",
    "version": "10.7717/peerj-cs.1023 (2022-08-08)",
    "status": "pinned"
  },
  "skill_version": "0.1.0",
  "rubric_version": "0.1.0-draft",
  "model": "unknown",
  "review": {
    "audience": "member_review_draft",
    "status": "draft",
    "public_export_sanitized": false
  },
  "evidence": [
    {
      "id": "E1",
      "source_location": "https://registry.example.org/about",
      "accessed": "2026-01-01",
      "provenance": "public_statement",
      "visibility": "public",
      "excerpt": "Fictional page describing the registry."
    },
    {
      "id": "E2",
      "source_location": "Restricted: fictional maintainer email, 2025-12-15",
      "accessed": "2026-01-01",
      "provenance": "maintainer_assertion",
      "visibility": "restricted"
    }
  ],
  "findings": [
    {
      "criterion_id": "BP1.1",
      "outcome": "unknown",
      "reason": "evidence_inaccessible",
      "note": "Fictional fixture: sufficient evidence was not supplied for this criterion."
    },
    {
      "criterion_id": "BP1.2",
      "outcome": "unknown",
      "reason": "evidence_inaccessible",
      "note": "Fictional fixture: sufficient evidence was not supplied for this criterion."
    },
    {
      "criterion_id": "BP1.3",
      "outcome": "unknown",
      "reason": "evidence_inaccessible",
      "note": "Fictional fixture: sufficient evidence was not supplied for this criterion."
    },
    {
      "criterion_id": "BP2.1",
      "outcome": "unknown",
      "reason": "evidence_inaccessible",
      "note": "Fictional fixture: sufficient evidence was not supplied for this criterion."
    },
    {
      "criterion_id": "BP2.2",
      "outcome": "unknown",
      "reason": "evidence_inaccessible",
      "note": "Fictional fixture: sufficient evidence was not supplied for this criterion."
    },
    {
      "criterion_id": "BP2.3",
      "outcome": "unknown",
      "reason": "evidence_inaccessible",
      "note": "Fictional fixture: sufficient evidence was not supplied for this criterion."
    },
    {
      "criterion_id": "BP2.4",
      "outcome": "unknown",
      "reason": "evidence_inaccessible",
      "note": "Fictional fixture: sufficient evidence was not supplied for this criterion."
    },
    {
      "criterion_id": "BP2.5",
      "outcome": "unknown",
      "reason": "evidence_inaccessible",
      "note": "Fictional fixture: sufficient evidence was not supplied for this criterion."
    },
    {
      "criterion_id": "BP2.6",
      "outcome": "unknown",
      "reason": "evidence_inaccessible",
      "note": "Fictional fixture: sufficient evidence was not supplied for this criterion."
    },
    {
      "criterion_id": "BP3.1",
      "outcome": "unknown",
      "reason": "evidence_inaccessible",
      "note": "Fictional fixture: sufficient evidence was not supplied for this criterion."
    },
    {
      "criterion_id": "BP3.2",
      "outcome": "unknown",
      "reason": "evidence_inaccessible",
      "note": "Fictional fixture: sufficient evidence was not supplied for this criterion."
    },
    {
      "criterion_id": "BP3.3",
      "outcome": "unknown",
      "reason": "evidence_inaccessible",
      "note": "Fictional fixture: sufficient evidence was not supplied for this criterion."
    },
    {
      "criterion_id": "BP3.4",
      "outcome": "unknown",
      "reason": "evidence_inaccessible",
      "note": "Fictional fixture: sufficient evidence was not supplied for this criterion."
    },
    {
      "criterion_id": "BP3.5",
      "outcome": "unknown",
      "reason": "evidence_inaccessible",
      "note": "Fictional fixture: sufficient evidence was not supplied for this criterion."
    },
    {
      "criterion_id": "BP3.6",
      "outcome": "unknown",
      "reason": "evidence_inaccessible",
      "note": "Fictional fixture: sufficient evidence was not supplied for this criterion."
    },
    {
      "criterion_id": "BP3.7",
      "outcome": "unknown",
      "reason": "evidence_inaccessible",
      "note": "Fictional fixture: sufficient evidence was not supplied for this criterion."
    },
    {
      "criterion_id": "BP3.8",
      "outcome": "unknown",
      "reason": "evidence_inaccessible",
      "note": "Fictional fixture: sufficient evidence was not supplied for this criterion."
    },
    {
      "criterion_id": "BP4.1",
      "outcome": "unknown",
      "reason": "evidence_inaccessible",
      "note": "Fictional fixture: sufficient evidence was not supplied for this criterion."
    },
    {
      "criterion_id": "BP4.2",
      "outcome": "unknown",
      "reason": "evidence_inaccessible",
      "note": "Fictional fixture: sufficient evidence was not supplied for this criterion."
    },
    {
      "criterion_id": "BP4.3",
      "outcome": "unknown",
      "reason": "evidence_inaccessible",
      "note": "Fictional fixture: sufficient evidence was not supplied for this criterion."
    },
    {
      "criterion_id": "BP4.4",
      "outcome": "unknown",
      "reason": "evidence_inaccessible",
      "note": "Fictional fixture: sufficient evidence was not supplied for this criterion."
    },
    {
      "criterion_id": "BP4.5",
      "outcome": "unknown",
      "reason": "evidence_inaccessible",
      "note": "Fictional fixture: sufficient evidence was not supplied for this criterion."
    },
    {
      "criterion_id": "BP4.6",
      "outcome": "unknown",
      "reason": "evidence_inaccessible",
      "note": "Fictional fixture: sufficient evidence was not supplied for this criterion."
    },
    {
      "criterion_id": "BP5.1",
      "outcome": "unknown",
      "reason": "evidence_inaccessible",
      "note": "Fictional fixture: sufficient evidence was not supplied for this criterion."
    },
    {
      "criterion_id": "BP5.2",
      "outcome": "unknown",
      "reason": "evidence_inaccessible",
      "note": "Fictional fixture: sufficient evidence was not supplied for this criterion."
    },
    {
      "criterion_id": "BP6.1",
      "outcome": "unknown",
      "reason": "evidence_inaccessible",
      "note": "Fictional fixture: sufficient evidence was not supplied for this criterion."
    },
    {
      "criterion_id": "BP6.2",
      "outcome": "unknown",
      "reason": "evidence_inaccessible",
      "note": "Fictional fixture: sufficient evidence was not supplied for this criterion."
    },
    {
      "criterion_id": "BP6.3",
      "outcome": "unknown",
      "reason": "evidence_inaccessible",
      "note": "Fictional fixture: sufficient evidence was not supplied for this criterion."
    },
    {
      "criterion_id": "BP6.4",
      "outcome": "unknown",
      "reason": "evidence_inaccessible",
      "note": "Fictional fixture: sufficient evidence was not supplied for this criterion."
    },
    {
      "criterion_id": "BP6.5",
      "outcome": "unknown",
      "reason": "evidence_inaccessible",
      "note": "Fictional fixture: sufficient evidence was not supplied for this criterion."
    },
    {
      "criterion_id": "BP7.1",
      "outcome": "unknown",
      "reason": "evidence_inaccessible",
      "note": "Fictional fixture: sufficient evidence was not supplied for this criterion."
    },
    {
      "criterion_id": "BP7.2",
      "outcome": "unknown",
      "reason": "evidence_inaccessible",
      "note": "Fictional fixture: sufficient evidence was not supplied for this criterion."
    },
    {
      "criterion_id": "BP7.3",
      "outcome": "unknown",
      "reason": "evidence_inaccessible",
      "note": "Fictional fixture: sufficient evidence was not supplied for this criterion."
    },
    {
      "criterion_id": "BP7.4",
      "outcome": "unknown",
      "reason": "evidence_inaccessible",
      "note": "Fictional fixture: sufficient evidence was not supplied for this criterion."
    },
    {
      "criterion_id": "BP7.5",
      "outcome": "unknown",
      "reason": "evidence_inaccessible",
      "note": "Fictional fixture: sufficient evidence was not supplied for this criterion."
    },
    {
      "criterion_id": "BP7.6",
      "outcome": "unknown",
      "reason": "evidence_inaccessible",
      "note": "Fictional fixture: sufficient evidence was not supplied for this criterion."
    },
    {
      "criterion_id": "BP7.7",
      "outcome": "unknown",
      "reason": "evidence_inaccessible",
      "note": "Fictional fixture: sufficient evidence was not supplied for this criterion."
    },
    {
      "criterion_id": "BP7.8",
      "outcome": "unknown",
      "reason": "evidence_inaccessible",
      "note": "Fictional fixture: sufficient evidence was not supplied for this criterion."
    },
    {
      "criterion_id": "BP7.9",
      "outcome": "unknown",
      "reason": "evidence_inaccessible",
      "note": "Fictional fixture: sufficient evidence was not supplied for this criterion."
    },
    {
      "criterion_id": "BP8.1",
      "outcome": "unknown",
      "reason": "evidence_inaccessible",
      "note": "Fictional fixture: sufficient evidence was not supplied for this criterion."
    },
    {
      "criterion_id": "BP8.2",
      "outcome": "unknown",
      "reason": "evidence_inaccessible",
      "note": "Fictional fixture: sufficient evidence was not supplied for this criterion."
    },
    {
      "criterion_id": "BP8.3",
      "outcome": "unknown",
      "reason": "evidence_inaccessible",
      "note": "Fictional fixture: sufficient evidence was not supplied for this criterion."
    },
    {
      "criterion_id": "BP8.4",
      "outcome": "unknown",